{
  "submittedOn":"2022-06-17T10:53:38Z",
  "ukFhlProperty":{
    "adjustments":{
      "lossBroughtForward":343.34,
      "privateUseAdjustment":454.45,
      "balancingCharge":231.45,
      "periodOfGraceAdjustment":true,
      "businessPremisesRenovationAllowanceBalancingCharges":567.67,
      "nonResidentLandlord":true,
      "rentARoom":{
        "jointlyLet":true
      }
    },
    "allowances":{
      "annualInvestmentAllowance":123.45,
      "businessPremisesRenovationAllowance":345.56,
      "otherCapitalAllowance":345.34,
      "electricChargePointAllowance":453.34,
      "zeroEmissionsCarAllowance":123.12
    }
  },
  "ukNonFhlProperty":{
    "adjustments":{
      "lossBroughtForward":334.45,
      "balancingCharge":565.34,
      "privateUseAdjustment":533.54,
      "businessPremisesRenovationAllowanceBalancingCharges":563.34,
      "nonResidentLandlord":true,
      "rentARoom":{
        "jointlyLet":true
      }
    },
    "allowances":{
      "annualInvestmentAllowance":678.45,
      "zeroEmissionGoodsVehicleAllowance":456.34,
      "businessPremisesRenovationAllowance":573.45,
      "otherCapitalAllowance":452.34,
      "costOfReplacingDomesticGoods":567.34,
      "electricChargePointAllowance":454.34,
      "structuredBuildingAllowance":[
        {
          "amount":234.34,
          "firstYear":{
            "qualifyingDate":"2020-03-29",
            "qualifyingAmountExpenditure":3434.45
          },
          "building":{
            "name":"Plaza",
            "number":"1",
            "postcode":"TF3 4EH"
          }
        }
      ],
      "enhancedStructuredBuildingAllowance":[
        {
          "amount":234.45,
          "firstYear":{
            "qualifyingDate":"2020-05-29",
            "qualifyingAmountExpenditure":453.34
          },
          "building":{
            "name":"Plaza 2",
            "number":"2",
            "postcode":"TF3 4ER"
          }
        }
      ],
      "zeroEmissionsCarAllowance":454.34
    }
  },
  "links": [
    {
      "href": "/individuals/business/property/uk/TC663795B/XAIS12345678910/annual/2022-23",
      "method": "PUT",
      "rel": "amend-uk-property-annual-submission"
    },
    {
      "href": "/individuals/business/property/uk/TC663795B/XAIS12345678910/annual/2022-23",
      "method": "GET",
      "rel": "self"
    },
    {
      "href": "/individuals/business/property/TC663795B/XAIS12345678910/annual/2022-23",
      "method": "DELETE",
      "rel": "delete-property-annual-submission"
    }
  ]
}