{
  "submittedOn":"2020-06-17T10:59:47.544Z",
  "ukFhlProperty":{
    "adjustments":{
      "balancingCharge":231.45,
      "periodOfGraceAdjustment":true,
      "businessPremisesRenovationAllowanceBalancingCharges":567.67,
      "nonResidentLandlord":true,
      "rentARoom":{
        "jointlyLet":true
      }
    },
    "allowances":{
      "propertyIncomeAllowance":453.45
    }
  },
  "ukNonFhlProperty":{
    "adjustments":{
      "balancingCharge":565.34,
      "businessPremisesRenovationAllowanceBalancingCharges":563.34,
      "nonResidentLandlord":true,
      "rentARoom":{
        "jointlyLet":true
      }
    },
    "allowances":{
      "propertyIncomeAllowance":342.34
    }
  },
  "links": [
    {
      "href": "/individuals/business/property/uk/TC663795B/XAIS12345678910/annual/2022-23",
      "method": "PUT",
      "rel": "amend-uk-property-annual-submission"
    },
    {
      "href": "/individuals/business/property/uk/TC663795B/XAIS12345678910/annual/2022-23",
      "method": "GET",
      "rel": "self"
    },
    {
      "href": "/individuals/business/property/TC663795B/XAIS12345678910/annual/2022-23",
      "method": "DELETE",
      "rel": "delete-property-annual-submission"
    }
  ]
}
